{
  "$schema": "../schemas/recipe.schema.json",
  "recipe_id": "nm000132-p3-cnd-events", "recipe_version": "0.4.0", "status": "reviewed",
  "source": {"dataset_id": "nm000132", "provider": "NEMAR", "url": "https://www.nemar.org/dataset/nm000132", "version": "1.1.1", "doi": "10.82901/nemar.nm000132", "primary_path": "sub-001/eeg/sub-001_task-P3_eeg.set", "files": [{"path": "sub-001/eeg/sub-001_task-P3_eeg.set", "url": "https://data.nemar.org/nm000132/v1.1.1/sub-001/eeg/sub-001_task-P3_eeg.set", "sha256": "49d6c037837c1ab3ec66911a296b32615eef744ed70edfa59f63a4c84baed086"}], "require_pinned_version_before_conversion": true},
  "selection": {"modality": "eeg", "subject": "001", "task": "P3", "reader": "bids", "extension": ".set", "events_path": "sub-001/eeg/sub-001_task-P3_events.tsv", "channel_type_policy": "eeg_with_external", "external_channel_types": ["eog"], "external_description": "ERP CORE EOG channels", "device_name": "BioSemi ActiveTwo (30 EEG channels + 3 external EOG channels)"},
  "trials": {"unit": "recording_run", "condition_name": "active_visual_oddball", "preserve_full_run": true},
  "features": [
    {"name": "target_onset", "kind": "bids_event_impulse", "source_column": "value", "source_values": ["11", "22", "33", "44", "55"], "unit": "binary"},
    {"name": "nontarget_onset", "kind": "bids_event_impulse", "source_column": "value", "source_values": ["12", "13", "14", "15", "21", "23", "24", "25", "31", "32", "34", "35", "41", "42", "43", "45", "51", "52", "53", "54"], "unit": "binary"},
    {"name": "correct_response_onset", "kind": "bids_event_impulse", "source_column": "value", "source_value": "201", "unit": "binary"},
    {"name": "incorrect_response_onset", "kind": "bids_event_impulse", "source_column": "value", "source_value": "202", "unit": "binary"}
  ],
  "synchronization": {"event_source": "BIDS events.tsv sample and onset columns", "event_sample_policy": "prefer_explicit_sample_and_reconcile_with_onset", "sample_index_origin": 1, "target_sampling_rate_hz": 1024, "resampling": false},
  "output": {"format": "CND 1.0", "mat_version": "5", "neural_unit": "V", "external_unit": "V", "strict_validation": true, "one_neural_file_per_subject": true, "shared_stimulus_file": true},
  "validation": {"require_source_checksum": true, "require_source_reconciliation": true, "require_cnd_mne_load": true, "require_round_trip_sample": true, "max_event_quantization_error_samples": 0.5},
  "license": {"neural_data": "CC-BY-4.0", "stimulus_assets": "No media are embedded; categorical event impulses only", "derived_release": "CC-BY-4.0 with ERP CORE attribution and provenance"},
  "notes": ["Corpus template: the pinned plan injects each recording's complete BIDS snapshot.", "The continuous recording is preserved without preprocessing; three EOG channels are retained in CND extChan rather than mixed into the EEG matrix."]
}
